{
  "document_id": "document_pdf_example001",
  "encrypted": false,
  "header": {
    "content_hash": "5e23a53c6d7840dca8c22ffcbb4300d674cc66e932cd340a6fc7c0f22fce7844",
    "contract_id": "profile_fixed_layout_ielpvizzawf7zutierdwzk7dj5",
    "created_at": "2026-06-20T07:10:14.039786Z",
    "extensions": {},
    "producer": "vysi.document_source",
    "producer_version": "0.4.0",
    "revision": 1,
    "schema_id": "document_source.profile_fixed_layout",
    "schema_version": "2.2.0",
    "status": "ok",
    "supersedes": null
  },
  "pages": [
    {
      "box_refs": [],
      "height_pt": 842.0,
      "ordinal": 0,
      "page_id": "page_example001",
      "rotation": 0,
      "source_address": "pdf:page[0]",
      "width_pt": 595.0
    }
  ],
  "profile_kind": "fixed_layout",
  "profile_version": "2.0.0",
  "repaired": false
}
